{
  "clearance_violations": 2,
  "phase_balance": 0.0463,
  "phase_totals": {
    "A": 460.0,
    "B": 400.0,
    "C": 436.0
  },
  "placements": [
    {
      "breaker_id": "L04A",
      "heat_w": 460.0,
      "phase": "A",
      "slot": "S01",
      "width_unit": 0.45
    },
    {
      "breaker_id": "L04B",
      "heat_w": 400.0,
      "phase": "B",
      "slot": "S02",
      "width_unit": 0.45
    },
    {
      "breaker_id": "L04C",
      "heat_w": 436.0,
      "phase": "C",
      "slot": "S03",
      "width_unit": 0.45
    }
  ],
  "slot_unit": 1.2
}