{
  "clearance_violations": 2,
  "phase_balance": 0.0556,
  "phase_totals": {
    "A": 120.0,
    "B": 130.0,
    "C": 110.0
  },
  "placements": [
    {
      "breaker_id": "L1",
      "heat_w": 120.0,
      "phase": "A",
      "slot": "S01",
      "width_unit": 0.4
    },
    {
      "breaker_id": "L2",
      "heat_w": 130.0,
      "phase": "B",
      "slot": "S02",
      "width_unit": 0.4
    },
    {
      "breaker_id": "L3",
      "heat_w": 110.0,
      "phase": "C",
      "slot": "S03",
      "width_unit": 0.4
    }
  ],
  "slot_unit": 1.0
}